text,span,label,ordinal
"The system constantly overheats, the battery life is too short, the case is coming apart, and my core applications that I use every day in my work as a graphic artist run poorly.",system,negative,0
  Later it held zero charge and its replacement worked for less than three months.,charge,negative,0
  The company sent me a whole new cord overnight and apologized.,cord,positive,0
It's even easy to hook up to other wireless networks.,hook up to other wireless networks,positive,0
"  Also, I have had alot of trouble with the shift key to go to other lines.",shift key,negative,0
"The rep did not even answer my question, I had to ask him, if he understood what I ask or if he spoke english because he didn't even try to acknowledge my question.",rep,negative,0
It gives me the power and speed that I need to run all the programs I use to edit.,power,positive,0
It gives me the power and speed that I need to run all the programs I use to edit.,speed,positive,0
It gives me the power and speed that I need to run all the programs I use to edit.,programs,neutral,0
iLife is easily compatible with Microsoft Office so you can send and receive files from a PC.,iLife,positive,0
iLife is easily compatible with Microsoft Office so you can send and receive files from a PC.,Microsoft Office,neutral,0
"As a computer science student in college, I find that the portability, longevity, and ease of use of this computer make me (shockingly) want to do homework more;",portability,positive,0
"As a computer science student in college, I find that the portability, longevity, and ease of use of this computer make me (shockingly) want to do homework more;",longevity,positive,0
"As a computer science student in college, I find that the portability, longevity, and ease of use of this computer make me (shockingly) want to do homework more;",use,positive,0
  Again I sent it back and they replaced the motherboard and some fan inside.,motherboard,neutral,0
  Again I sent it back and they replaced the motherboard and some fan inside.,fan,neutral,0
"Fully charged, the MacBook Pro can last about five hours unplugged.",charged,positive,0
"Even though it is much more expensive than many PC laptops, it is worth the price.",price,conflict,0
"I know there are way better laptops out there for the same price, and why spend money on shit when you can go out and get yourself a perfectly decent laptop that doesnt suck total monkey balls.",price,neutral,0
"For me, keys were starting to get stuck and wouldn't type very well.",keys,negative,0
can't reinstall with standard os cd because of proprietary hardware drivers.,standard os cd,negative,0
can't reinstall with standard os cd because of proprietary hardware drivers.,proprietary hardware drivers,negative,0
"There is a small red circle next to it with a x in the middle, and when I click on it it says: "" Consider replacing your battery"" and it does not hold full charge.",battery,neutral,0
"There is a small red circle next to it with a x in the middle, and when I click on it it says: "" Consider replacing your battery"" and it does not hold full charge.",charge,negative,0
The computer was two weeks late in delivery because HP forgot to complete the required import paperwork.,delivery,negative,0
The first programm I switched on was a game for my children.,programm,neutral,0
I have been very pleased with the performance of this laptop.,performance,positive,0
"I bought it for my mom and she reports that the battery life lasts all day for her, it's very lightweight, and the response for the computing she's doing (Internet focused activity: mail, research, etc.) is excellent;",battery life,positive,0
"I bought it for my mom and she reports that the battery life lasts all day for her, it's very lightweight, and the response for the computing she's doing (Internet focused activity: mail, research, etc.) is excellent;",response,positive,0
"I bought it for my mom and she reports that the battery life lasts all day for her, it's very lightweight, and the response for the computing she's doing (Internet focused activity: mail, research, etc.) is excellent;",Internet focused activity,neutral,0
Its very nice and once you learn the features you will be so happy to have such a sophisticated computer.,features,neutral,0
It is sleek and lightweight and charges quickly when needed.,charges,positive,0
"also you may need to charge it once a day, if for medium use every thing fast and easy with mac  the size and look is the most feature that attracted me to it.",size,positive,0
"also you may need to charge it once a day, if for medium use every thing fast and easy with mac  the size and look is the most feature that attracted me to it.",look,positive,0
"also you may need to charge it once a day, if for medium use every thing fast and easy with mac  the size and look is the most feature that attracted me to it.",feature,positive,0
"also you may need to charge it once a day, if for medium use every thing fast and easy with mac  the size and look is the most feature that attracted me to it.",charge,neutral,0
( The iBook backup also uses a firewire connection).,iBook backup,neutral,0
( The iBook backup also uses a firewire connection).,firewire connection,neutral,0
"I did think it had a camera because that was one of my requirements, but forgot to check in the specifications on this one before I purchased.",camera,neutral,0
"I did think it had a camera because that was one of my requirements, but forgot to check in the specifications on this one before I purchased.",specifications,neutral,0
Also the display is exceptional!,display,positive,0
The computer was shipped to their repair depot  on june 24 and returned on July 2 seems like a short turn around time except the computer was not repaired when it was returned.,repair depot,neutral,0
Learning all of the keyboard shortcuts only took a few minutes to get used to as some of the shortcuts are the same on Windows machines.,keyboard shortcuts,positive,0
Learning all of the keyboard shortcuts only took a few minutes to get used to as some of the shortcuts are the same on Windows machines.,shortcuts,neutral,1
little short on RAM but you get what you pay for.,RAM,negative,0
"It didn't come with any software installed outside of windows media, but for the price, I was very pleased with the condition and the overall product.",software,negative,0
"It didn't come with any software installed outside of windows media, but for the price, I was very pleased with the condition and the overall product.",windows media,neutral,0
"It didn't come with any software installed outside of windows media, but for the price, I was very pleased with the condition and the overall product.",price,positive,0
"THEN, one month after the warranty expired, the replacement charger went.",warranty,neutral,0
"THEN, one month after the warranty expired, the replacement charger went.",replacement charger,negative,0
"I love a ""pc"" but I was ready for a change and tired of the windows system.",windows system,negative,0
"Your cursor will end up all over the freaking place,,,it's not uncommon for me to accidentally delete words, sentences, paragraphs because of this mousepad.",cursor,negative,0
"Your cursor will end up all over the freaking place,,,it's not uncommon for me to accidentally delete words, sentences, paragraphs because of this mousepad.",mousepad,negative,0
"Other installed features, such as certain printer software, are also most attractive.",features,positive,0
"Other installed features, such as certain printer software, are also most attractive.",printer software,positive,0
"I work in film editing and post production, so I need a laptop that not only has power, but memory and speed as well.",power,neutral,0
"I work in film editing and post production, so I need a laptop that not only has power, but memory and speed as well.",memory,neutral,0
"I work in film editing and post production, so I need a laptop that not only has power, but memory and speed as well.",speed,neutral,0
"It had a seventeen inch screen which I wanted, but I didn't realize at the time it would be such a monster!",seventeen inch screen,conflict,0
"Even doing so, the hinge may just be slightly tightened only.",hinge,neutral,0
"company provides UPS shipping, fast, great!",shipping,positive,0
I would tell the technician I knew exactly what was wrong with it but they did not listen and I had to go through a bunch of junk to get them to tell me I needed to send the computer in.,technician,negative,0
"  Then I've fixed the DC jack (inside the unit), rewired the DC jack to the OUTside of the laptop, replaced the power brick.",DC jack,neutral,0
"  Then I've fixed the DC jack (inside the unit), rewired the DC jack to the OUTside of the laptop, replaced the power brick.",DC jack,neutral,1
"  Then I've fixed the DC jack (inside the unit), rewired the DC jack to the OUTside of the laptop, replaced the power brick.",power brick,neutral,0
"It is easy to use, has great screen quality, and every so light weight.",screen quality,positive,0
"It is easy to use, has great screen quality, and every so light weight.",use,positive,0
"Great product, very easy to use and great graphics.",graphics,positive,0
"Great product, very easy to use and great graphics.",use,positive,0
The iLife software that comes with the computer is so simple to use and produces a great finished product.,iLife software,positive,0
The iLife software that comes with the computer is so simple to use and produces a great finished product.,use,positive,0
The built-in webcam is great for Skype and similar video-chat services.,built-in webcam,positive,0
The shop will definitely push the problem to the service center.,service center,neutral,0
"PC users work in Word, while Mac users work in Pages.",Word,neutral,0
"PC users work in Word, while Mac users work in Pages.",Pages,neutral,0
"While I mostly use it for email, internet and gaming, I'm confident all other applications live up to the high standard I've come to appreciate from Mac laptops.",applications,positive,0
"While I mostly use it for email, internet and gaming, I'm confident all other applications live up to the high standard I've come to appreciate from Mac laptops.",internet,neutral,0
"While I mostly use it for email, internet and gaming, I'm confident all other applications live up to the high standard I've come to appreciate from Mac laptops.",gaming,neutral,0
"This laptop looks great on the surface: 17"" inch screen, good  price-point, nice appearance, boots up quickly, runs fast etc.","17"" inch screen",positive,0
"This laptop looks great on the surface: 17"" inch screen, good  price-point, nice appearance, boots up quickly, runs fast etc.",price-point,positive,0
"This laptop looks great on the surface: 17"" inch screen, good  price-point, nice appearance, boots up quickly, runs fast etc.",appearance,positive,0
"This laptop looks great on the surface: 17"" inch screen, good  price-point, nice appearance, boots up quickly, runs fast etc.",boots up,positive,0
"This laptop looks great on the surface: 17"" inch screen, good  price-point, nice appearance, boots up quickly, runs fast etc.",runs,positive,0
"The apple systems are over priced luxurys that arn't worth what they are being charged for, this model's specifications are far from being impressive and they only thing you get out of this is the apple name.",specifications,negative,0
pros:  the macbook pro notebook has a large battery life and you wont have to worry to charge your laptop every five hours or so.,battery life,positive,0
Disappointing for such a lovely screen and at a reasonable price,screen,positive,0
Disappointing for such a lovely screen and at a reasonable price,price,positive,0
The only bad thing about it is they give you the worst batteries possible.,batteries,negative,0
Good price.,price,positive,0
 THE MOTHERBOARD IS DEAD !,MOTHERBOARD,negative,0
the speed is fine.,speed,positive,0
Hmmm - that high failure rate sure isn't reflected in the retail price.,retail price,negative,0
"It was not clear that the Microsoft Student Edition that was loaded on the computer, was a six month trial.",Microsoft Student Edition,negative,0
Good for every day computing and web browsing.,web browsing,positive,0
Good for every day computing and web browsing.,every day computing,positive,0
"While lacking some of the functions of the other versions, this was very acceptable for the uses planned for this computer.",functions,conflict,0
"  Also, I have had alot of trouble with the keys sticking and will not type correctly.",keys,negative,0
Excellent LED monitor and well equipped.,LED monitor,positive,0
  This process continued to repeat itself until the mother board had been replaced 4 times and the hard drive replaced 3 times.,mother board,negative,0
  This process continued to repeat itself until the mother board had been replaced 4 times and the hard drive replaced 3 times.,hard drive,negative,0
"Without a doubt, the *design* of this laptop is fantastic.",design,positive,0
I couldn't believe how long the battery lasted on a single charge.,battery,positive,0
I couldn't believe how long the battery lasted on a single charge.,charge,positive,0
I could save ten essay papers and have hardly any memory left.,memory,negative,0
"Other than that, I would recommend this to someone in need of a cheap laptop with semi-decent gaming capabilities.",gaming,positive,0
"This is the first time that I tried and owning a netbook although I have used 3 different laptops in the past 10 years, I find not much difference except of course for the screen size.",screen size,neutral,0
But the biggest pain is that tech support is not available 24/7.,tech support,negative,0
The backlit keys are wonderful when you are working in the dark.,backlit keys,positive,0
"I chose the iBookG4, a laptop that is an attractive computer with a large screen big enough to please anyone.",screen,positive,0
"The most recent being that my Safari internet browser is freaking out on me, but I have just been using firefox instead.",Safari internet browser,negative,0
"The most recent being that my Safari internet browser is freaking out on me, but I have just been using firefox instead.",firefox,positive,0
"Everything about the Mac is not only visually appealing, but very easy to use.",use,positive,0
I know what 7 hrs of battery looks like.,battery,positive,0
I did not have to call the support line at all.,support line,neutral,0
The laptop is outstanding in all aspects except that it has the Windows 7 starter and not the full Windows 7.,Windows 7 starter,negative,0
The laptop is outstanding in all aspects except that it has the Windows 7 starter and not the full Windows 7.,Windows 7,positive,1
THE FIRST PROBLEM IS THAT THE KEYBOARD FUNCTION IS SIMPLY UNSATISFACTORY.,KEYBOARD FUNCTION,negative,0
"The DVD drive randomly pops open when it is in my backpack as well, which is annoying.",DVD drive,negative,0
"Garageband is more for the musicians, and the laptop is equipped with a good working microphone, good enough for beginners and musicians at the intermediate level.",Garageband,neutral,0
"Garageband is more for the musicians, and the laptop is equipped with a good working microphone, good enough for beginners and musicians at the intermediate level.",microphone,positive,0
I dual boot with Linux and that other security-prone OS and it performs flawlessly.,Linux,neutral,0
I dual boot with Linux and that other security-prone OS and it performs flawlessly.,security-prone OS,neutral,0
I dual boot with Linux and that other security-prone OS and it performs flawlessly.,performs,positive,0
The difference is the Toshiba had a lot more memory and hard drive space.,memory,positive,0
The difference is the Toshiba had a lot more memory and hard drive space.,hard drive space,positive,0
There was a little difficulty doing the migration as the firewire cable system can't be used with the iBook.,firewire cable system,negative,0
There was a little difficulty doing the migration as the firewire cable system can't be used with the iBook.,iBook,neutral,0
Seems like maybe a bad shipment from Toshiba.,shipment,negative,0
OS X is solid with lots of innovations such as quicklook which save heaps of time.,OS X,positive,0
OS X is solid with lots of innovations such as quicklook which save heaps of time.,quicklook,positive,0
But other than that I am blown away by all the features this laptop offers.,features,positive,0
The keyboard is slick and quiet and not bulky like some other laptops I have had in the past.,keyboard,positive,0
"Overall, this laptop is definitely a keeper with its simple yet stylish design and its array of fantastic colors to choose from.",design,positive,0
"Overall, this laptop is definitely a keeper with its simple yet stylish design and its array of fantastic colors to choose from.",colors,positive,0
First the screen goes completely out.,screen,negative,0
I'm learning the finger options for the mousepad that allow for quicker browsing of web pages.,mousepad,positive,0
I'm learning the finger options for the mousepad that allow for quicker browsing of web pages.,browsing,positive,0
"The PhotoBooth is a great program, it takes very good pictures with the built-in camera.",PhotoBooth,positive,0
"The PhotoBooth is a great program, it takes very good pictures with the built-in camera.",program,positive,0
"The PhotoBooth is a great program, it takes very good pictures with the built-in camera.",built-in camera,positive,0
Many kinds of software that is necessary to the working person is not available and cannot be downloaded.,software,negative,0
I had to pay for the shipping!,shipping,negative,0
"It bluescreened on me without any warning, running simply basic Chrome.",Chrome,negative,0
I took 3-4 years researching brands and prices of laptops.,prices,neutral,0
We researched and found the best price at MacConnection.,price,positive,0
But guess what?  (you have to buy an external dvd drive it doesn't have a built in type) The notebook can't be used because it doesn't read anything for an external drive.,external dvd drive,negative,0
But guess what?  (you have to buy an external dvd drive it doesn't have a built in type) The notebook can't be used because it doesn't read anything for an external drive.,external drive,negative,0
GET THIS COMPUTER FOR PORTABILITY AND FAST PROCESSING!!!,PORTABILITY,positive,0
GET THIS COMPUTER FOR PORTABILITY AND FAST PROCESSING!!!,PROCESSING,positive,0
I use a cooling pad but it doesn't help.,cooling pad,negative,0
Supplied software: The software that comes with this machine is greatly welcomed compared to what Windows comes with.,Supplied software,neutral,0
Supplied software: The software that comes with this machine is greatly welcomed compared to what Windows comes with.,software,positive,1
Supplied software: The software that comes with this machine is greatly welcomed compared to what Windows comes with.,Windows,negative,0
I'm tired of the inept service.,service,negative,0
"Garageband is easy to work with, like all the other apple applications I've had experience with.",Garageband,positive,0
"Garageband is easy to work with, like all the other apple applications I've had experience with.",apple applications,positive,0
"No, tey don't even support their own bios and it ""could be a problem with the bios"" How can a company that makes a fairly decent product get away with such insanity??!!",bios,negative,0
"No, tey don't even support their own bios and it ""could be a problem with the bios"" How can a company that makes a fairly decent product get away with such insanity??!!",bios,negative,1
"Because we did not purchase the extended warranty in time, we are on the hook for the repair.",extended warranty,negative,0
"It started out by randomly ceasing to charge when it was plugged in (mousing over the battery icon would read, for example, ""74%, plugged in, not charging""), requiring me to unplug it and plug it back in several times to get it to charge.",charging,negative,0
"It started out by randomly ceasing to charge when it was plugged in (mousing over the battery icon would read, for example, ""74%, plugged in, not charging""), requiring me to unplug it and plug it back in several times to get it to charge.",charge,negative,0
"It started out by randomly ceasing to charge when it was plugged in (mousing over the battery icon would read, for example, ""74%, plugged in, not charging""), requiring me to unplug it and plug it back in several times to get it to charge.",charge,neutral,1
This laptop looked brand new and was shipped very quickly.,shipped,positive,0
"Info: Windows failed to load because the kernal is missing, or corrupt.",Windows,negative,0
"Info: Windows failed to load because the kernal is missing, or corrupt.",kernal,negative,0
"The display on this computer is the best I've seen in a very long time, the battery life is very long and very convienent.",display,positive,0
"The display on this computer is the best I've seen in a very long time, the battery life is very long and very convienent.",battery life,positive,0
"But the quality, in general was less than the worth of the cheap laptop.",quality,negative,0
In the first moth of owning this computer its hardrive failed which had to be replaced.,hardrive,negative,0
Its also FUN to use!,use,positive,0
"The graphics and screen are stunning and although I was a PC person, I was able to understand how to use a mac fairly quickly.",graphics,positive,0
"The graphics and screen are stunning and although I was a PC person, I was able to understand how to use a mac fairly quickly.",screen,positive,0
"WIth the upgraded memory, the MacBook Pro never has an issue running many many applications at once!",upgraded memory,positive,0
"WIth the upgraded memory, the MacBook Pro never has an issue running many many applications at once!",applications,neutral,0
"WIth the upgraded memory, the MacBook Pro never has an issue running many many applications at once!",running,positive,0
"Simple to use, and great graphics.",graphics,positive,0
"Simple to use, and great graphics.",use,positive,0
The internet speed is spectacular.,internet speed,positive,0
They claim call center is still down.,call center,negative,0
Mac also has many apps and programs that are quite cheap or free.,apps,positive,0
Mac also has many apps and programs that are quite cheap or free.,programs,positive,0
"My husband uses it mostly for games, email and music.",games,neutral,0
I just took the broken cords into the Apple store and they gave me new ones.,cords,positive,0
"Apparently under the screen there are 2 little screws and when the screen gets moved back and forth, they come loose.",screen,neutral,0
"Apparently under the screen there are 2 little screws and when the screen gets moved back and forth, they come loose.",screen,neutral,1
"Being a PC user my whole life, it's taking a bit of time to adapt to the OS of a Mac but I'm finding my way around.",OS,neutral,0
The computer will constantly be getting hot and burning your leg unless you go through the hassle of taking off the entire back of it just to clean out the fan.,fan,negative,0
"I have in the past gotten superfine sandpaper and ""fixed"" the edges by rounding them off.",edges,negative,0
Downfalls: sharp edges.,edges,negative,0
i needed one to be able to carry to work everyday and this one seems to fit all of the criteria.,carry,neutral,0
The screen is gorgeous - yummy good.,screen,positive,0
"Did I mention everything about it, from size to weight to keyboard screams BULK?",size,negative,0
"Did I mention everything about it, from size to weight to keyboard screams BULK?",weight,negative,0
"Did I mention everything about it, from size to weight to keyboard screams BULK?",keyboard,negative,0
I had it four months when my disc drive refused to open.,disc drive,negative,0
"So, after Apple replaced the hard drive I enjoyed another 4 months of my new computer, until it froze this morning--completely.",hard drive,neutral,0
"Once again, I was told it was the suspicious  power supply  problem.",power supply,negative,0
"The Macbook starts fast, doesn't crash, has a fantastic display, is small and light (I have the 13.3"" model), and isn't always complaining about updates, lost connections, errors, blue screens, etc.",display,positive,0
"The Macbook starts fast, doesn't crash, has a fantastic display, is small and light (I have the 13.3"" model), and isn't always complaining about updates, lost connections, errors, blue screens, etc.",starts,positive,0
Unable to boot up this brand new laptop.,boot up,negative,0
"In addition, all the design tools on Pages and Keynotes makes it much easier to create professional looking documents and presentations.",Pages,positive,0
"In addition, all the design tools on Pages and Keynotes makes it much easier to create professional looking documents and presentations.",Keynotes,positive,0
" I actually had the hard drive replaced twice, the mother board once, the dvd drive twice, then they FINALLY agreed to replace it, (ALL OF THIS IN LESS THAN 1 1/2 YEARS!",hard drive,negative,0
" I actually had the hard drive replaced twice, the mother board once, the dvd drive twice, then they FINALLY agreed to replace it, (ALL OF THIS IN LESS THAN 1 1/2 YEARS!",mother board,negative,0
" I actually had the hard drive replaced twice, the mother board once, the dvd drive twice, then they FINALLY agreed to replace it, (ALL OF THIS IN LESS THAN 1 1/2 YEARS!",dvd drive,negative,0
"The guy then said that if I insist on having the hinge tightened, they can do it for me but I have to accept the condition after the ""repair"".",hinge,neutral,0
"The port is secured to motherboard so when this  happens you can't see the plug at all, it's just gone.",motherboard,neutral,0
"The port is secured to motherboard so when this  happens you can't see the plug at all, it's just gone.",port,neutral,0
