text,span,label,ordinal
I charge it at night and skip taking the cord with me because of the good battery life.,cord,neutral,0
I charge it at night and skip taking the cord with me because of the good battery life.,battery life,positive,0
"The tech guy then said the service center does not do 1-to-1 exchange and I have to direct my concern to the ""sales"" team, which is the retail shop which I bought my netbook from.",service center,negative,0
"The tech guy then said the service center does not do 1-to-1 exchange and I have to direct my concern to the ""sales"" team, which is the retail shop which I bought my netbook from.","""sales"" team",negative,0
"The tech guy then said the service center does not do 1-to-1 exchange and I have to direct my concern to the ""sales"" team, which is the retail shop which I bought my netbook from.",tech guy,neutral,0
"it is of high quality, has a killer GUI, is extremely stable, is highly expandable, is bundled with lots of very good applications, is easy to use, and is absolutely gorgeous.",quality,positive,0
"it is of high quality, has a killer GUI, is extremely stable, is highly expandable, is bundled with lots of very good applications, is easy to use, and is absolutely gorgeous.",GUI,positive,0
"it is of high quality, has a killer GUI, is extremely stable, is highly expandable, is bundled with lots of very good applications, is easy to use, and is absolutely gorgeous.",applications,positive,0
"it is of high quality, has a killer GUI, is extremely stable, is highly expandable, is bundled with lots of very good applications, is easy to use, and is absolutely gorgeous.",use,positive,0
Easy to start up and does not overheat as much as other laptops.,start up,positive,0
"I even got my teenage son one, because of the features that it offers, like, iChat, Photobooth, garage band and more!",features,positive,0
"I even got my teenage son one, because of the features that it offers, like, iChat, Photobooth, garage band and more!",iChat,positive,0
"I even got my teenage son one, because of the features that it offers, like, iChat, Photobooth, garage band and more!",Photobooth,positive,0
"I even got my teenage son one, because of the features that it offers, like, iChat, Photobooth, garage band and more!",garage band,positive,0
Great laptop that offers many great features!,features,positive,0
" One night I turned the freaking thing off after using it, the next day I turn it on, no GUI, screen all dark, power light steady, hard drive light steady and not flashing as it usually does.",GUI,negative,0
" One night I turned the freaking thing off after using it, the next day I turn it on, no GUI, screen all dark, power light steady, hard drive light steady and not flashing as it usually does.",screen,negative,0
" One night I turned the freaking thing off after using it, the next day I turn it on, no GUI, screen all dark, power light steady, hard drive light steady and not flashing as it usually does.",power light,neutral,0
" One night I turned the freaking thing off after using it, the next day I turn it on, no GUI, screen all dark, power light steady, hard drive light steady and not flashing as it usually does.",hard drive light,negative,0
I took it back for an Asus and same thing- blue screen which required me to remove the battery to reset.,battery,neutral,0
"In the shop, these MacBooks are encased in a soft rubber enclosure - so you will never know about the razor edge until you buy it, get it home, break the seal and use it (very clever con).",rubber enclosure,positive,0
"In the shop, these MacBooks are encased in a soft rubber enclosure - so you will never know about the razor edge until you buy it, get it home, break the seal and use it (very clever con).",edge,negative,0
"However, the multi-touch gestures and large tracking area make having an external mouse unnecessary (unless you're gaming).",multi-touch gestures,positive,0
"However, the multi-touch gestures and large tracking area make having an external mouse unnecessary (unless you're gaming).",tracking area,positive,0
"However, the multi-touch gestures and large tracking area make having an external mouse unnecessary (unless you're gaming).",external mouse,neutral,0
"However, the multi-touch gestures and large tracking area make having an external mouse unnecessary (unless you're gaming).",gaming,neutral,0
I love the way the entire suite of software works together.,suite of software,positive,0
The speed is incredible and I am more than satisfied.,speed,positive,0
This laptop meets every expectation and Windows 7 is great!,Windows 7,positive,0
I can barely use any usb devices because they will not stay connected properly.,usb devices,negative,0
"-No backlit keyboard, but not an issue for me.",keyboard,conflict,0
When I finally had everything running with all my software installed I plugged in my droid to recharge and the system crashed.,software,neutral,0
When I finally had everything running with all my software installed I plugged in my droid to recharge and the system crashed.,system,negative,0
"One suggestion I do have, is to not bother getting Microsoft office for the mac expecting it will work just like you knew it to on a PC.",Microsoft office for the mac,negative,0
Pairing it with an iPhone is a pure pleasure - talk about painless syncing - used to take me forever - now it's a snap.,syncing,positive,0
"I also got the added bonus of a 30"" HD Monitor, which really helps to extend my screen and keep my eyes fresh!","30"" HD Monitor",positive,0
"I also got the added bonus of a 30"" HD Monitor, which really helps to extend my screen and keep my eyes fresh!",screen,neutral,0
The machine is slow to boot up and occasionally crashes completely.,boot up,negative,0
"After paying several hundred dollars for this service, it is frustrating that you cannot get help after hours.",service,negative,0
"I did have to replace the battery once, but that was only a couple months ago and it's been working perfect ever since.",battery,conflict,0
I love the operating system and the preloaded software.,operating system,positive,0
I love the operating system and the preloaded software.,preloaded software,positive,0
The best thing about this laptop is the price along with some of the newer features.,price,positive,0
The best thing about this laptop is the price along with some of the newer features.,features,positive,0
"After numerous attempts of trying (including setting the clock in BIOS setup directly), I gave up(I am a techie).",clock in BIOS setup,negative,0
YOU WILL NOT BE ABLE TO TALK TO AN AMERICAN WARRANTY SERVICE IS OUT OF COUNTRY.,WARRANTY SERVICE,negative,0
but now i have realized its a problem with this brand.,brand,negative,0
I sent it back to Toshiba twice they covered it under the  warranty.,warranty,positive,0
I was looking for a mac which is portable and has all the features that I was looking for.,features,positive,0
Also kinda loud when the fan was running.,fan,negative,0
"In desparation, I called their Customer Service number and was told that my warranty had expired (2 days old) and that the priviledge of talking to a technician would cost me (""have your credit card ready"").",Customer Service number,neutral,0
"In desparation, I called their Customer Service number and was told that my warranty had expired (2 days old) and that the priviledge of talking to a technician would cost me (""have your credit card ready"").",warranty,negative,0
"In desparation, I called their Customer Service number and was told that my warranty had expired (2 days old) and that the priviledge of talking to a technician would cost me (""have your credit card ready"").",talking to a technician,negative,0
There also seemed to be a problem with the hard disc as certain times windows loads but claims to not be able to find any drivers or files.,hard disc,negative,0
There also seemed to be a problem with the hard disc as certain times windows loads but claims to not be able to find any drivers or files.,windows,negative,0
There also seemed to be a problem with the hard disc as certain times windows loads but claims to not be able to find any drivers or files.,drivers,neutral,0
Drivers updated ok but the BIOS update froze the system up and the computer shut down.,Drivers,positive,0
Drivers updated ok but the BIOS update froze the system up and the computer shut down.,BIOS update,negative,0
Drivers updated ok but the BIOS update froze the system up and the computer shut down.,system,negative,0
Spent 2 hours on phone with HP Technical Support.,HP Technical Support,neutral,0
"Speaking of the browser, it too has problems.",browser,negative,0
The keyboard is too slick.,keyboard,negative,0
Nightly my computer defrags itself and runs a virus scan.,virus scan,neutral,0
"It's like 9 punds, but if you can look past it, it's GREAT!",9 punds,negative,0
It's just as fast with one program open as it is with sixteen open.,program,neutral,0
"Still under warrenty so called Toshiba, no help at all.",warrenty,negative,0
I was happy with My purchase of a Toshiba Satellite L305D-S5934 laptop until it came time to have it repaired under the Toshiba Warranty.,Toshiba Warranty,negative,0
Amazing Quality!,Quality,positive,0
The fact that you can spend over $100 on just a webcam underscores the value of this machine.,webcam,neutral,0
The fact that you can spend over $100 on just a webcam underscores the value of this machine.,value,positive,0
"I mainly use it for email, internet, and managing personal files (pics, vids, etc.).",internet,neutral,0
"I mainly use it for email, internet, and managing personal files (pics, vids, etc.).",managing personal files,neutral,0
"A month or so ago, the freaking motherboard just died.",motherboard,negative,0
"The system it comes with does not work properly, so when trying to fix the problems with it it started not working at all.",system,negative,0
Then after 4 or so months the charger stopped working so I was forced to go out and buy new hardware just to keep this computer running.,charger,negative,0
Then after 4 or so months the charger stopped working so I was forced to go out and buy new hardware just to keep this computer running.,hardware,negative,0
"If a website ever freezes (which is rare), its really easy to force quit.",force quit,positive,0
It rarely works and when it does it's incredibly slow.,works,negative,0
I also enjoy the fact that my MacBook Pro laptop allows me to run Windows 7 on it by using the VMWare program.,Windows 7,positive,0
I also enjoy the fact that my MacBook Pro laptop allows me to run Windows 7 on it by using the VMWare program.,VMWare program,neutral,0
"It's so much easier to navigate through the operating system, to find files, and it runs a lot faster!",operating system,positive,0
"It's so much easier to navigate through the operating system, to find files, and it runs a lot faster!",runs,positive,0
"It's so much easier to navigate through the operating system, to find files, and it runs a lot faster!",navigate,positive,0
"It's so much easier to navigate through the operating system, to find files, and it runs a lot faster!",find files,positive,0
Purchased a Toshiba Lap top it worked good until just after the warrenty went out.,warrenty,negative,0
"I wanted to purchase the extended warranty and they refused, because they knew it was trouble.",extended warranty,neutral,0
We upgraded the memory to four gigabytes in order to take advantage of the performace increase in speed.,memory,neutral,0
We upgraded the memory to four gigabytes in order to take advantage of the performace increase in speed.,speed,positive,0
We upgraded the memory to four gigabytes in order to take advantage of the performace increase in speed.,performace,positive,0
"The reality was, it heated up very quickly, and took way too long to do simple things, like opening my Documents folder.",opening my Documents folder,negative,0
I had always used PCs and been constantly frustrated by the crashing and the poorly designed operating systems that were never very intuitive.,operating systems,negative,0
"Then, within 5 months, the charger crapped out on me.",charger,negative,0
And if you have a iphone or ipod touch you can connect and download songs to it at high speed.,speed,positive,0
I love the glass touchpad.,glass touchpad,positive,0
  I continued to take the computer in AGAIN and they replaced the hard drive and mother board yet again.,hard drive,negative,0
  I continued to take the computer in AGAIN and they replaced the hard drive and mother board yet again.,mother board,negative,0
I am using the external speaker- sound is good.,external speaker,positive,0
I am using the external speaker- sound is good.,sound,positive,0
"still testing the battery life as i thought it would be better, but am very happy with the upgrade.",battery life,negative,0
"Then HP sends it back to me with the hardware screwed up, not able to connect.",hardware,negative,0
"Oh yeah, don't forget the expensive shipping to and from HP.",shipping,negative,0
"Everything is so easy to use, Mac software is just so much simpler than Microsoft software.",Mac software,positive,0
"Everything is so easy to use, Mac software is just so much simpler than Microsoft software.",Microsoft software,negative,0
"Everything is so easy to use, Mac software is just so much simpler than Microsoft software.",use,positive,0
"And if you do a lot of writing, editing is a problem since there is no  forward delete  key.",delete  key,negative,0
"And if you do a lot of writing, editing is a problem since there is no  forward delete  key.",editing,negative,0
Its ease of use and the top service from Apple- be it their phone assistance or bellying up to the genius bar- cannot be beat.,use,positive,0
Its ease of use and the top service from Apple- be it their phone assistance or bellying up to the genius bar- cannot be beat.,service,positive,0
Its ease of use and the top service from Apple- be it their phone assistance or bellying up to the genius bar- cannot be beat.,phone assistance,positive,0
Its ease of use and the top service from Apple- be it their phone assistance or bellying up to the genius bar- cannot be beat.,genius bar,positive,0
"It has a 10 hour battery life when you're doing web browsing and word editing, making it perfect for the classroom or office, and in terms of gaming and movie playing it'll have a battery life of just over 5 hours.",battery life,positive,0
"It has a 10 hour battery life when you're doing web browsing and word editing, making it perfect for the classroom or office, and in terms of gaming and movie playing it'll have a battery life of just over 5 hours.",battery life,positive,1
"It has a 10 hour battery life when you're doing web browsing and word editing, making it perfect for the classroom or office, and in terms of gaming and movie playing it'll have a battery life of just over 5 hours.",gaming,neutral,0
"It has a 10 hour battery life when you're doing web browsing and word editing, making it perfect for the classroom or office, and in terms of gaming and movie playing it'll have a battery life of just over 5 hours.",movie playing,neutral,0
"It has a 10 hour battery life when you're doing web browsing and word editing, making it perfect for the classroom or office, and in terms of gaming and movie playing it'll have a battery life of just over 5 hours.",web browsing,neutral,0
"It has a 10 hour battery life when you're doing web browsing and word editing, making it perfect for the classroom or office, and in terms of gaming and movie playing it'll have a battery life of just over 5 hours.",word editing,neutral,0
"Acer has set me up with FREE recovery discs, when they are available since I asked.",recovery discs,positive,0
"I also purchased Office Max's ""Max Assurance"" with the ""no lemon"" clause.","Office Max's ""Max Assurance""",neutral,0
I eventually did the migration from my iMac backup disc which uses USB.,iMac backup disc,neutral,0
I eventually did the migration from my iMac backup disc which uses USB.,USB,neutral,0
"The battery life seems to be very good, and have had no issues with it.",battery life,positive,0
Enabling the battery timer is useless.,battery timer,negative,0
Temperatures on the outside were alright but i did not track in Core Processing Unit temperatures.,Temperatures,neutral,0
Temperatures on the outside were alright but i did not track in Core Processing Unit temperatures.,Core Processing Unit temperatures,neutral,0
Going to bring it to service today.,service,neutral,0
"There is no need to purchase virus protection for Mac, which saves me a lot of time and money.",virus protection for Mac,positive,0
"But we had paid for bluetooth, and there was none.",bluetooth,negative,0
"So, I paid a visit to LG notebook service center at Alexandra Road, hoping they can make the hinge tighter.",LG notebook service center,neutral,0
"So, I paid a visit to LG notebook service center at Alexandra Road, hoping they can make the hinge tighter.",hinge,negative,0
"My daughter uses it for games, email, facebook, pictures and music.",games,neutral,0
"It is always reliable, never bugged and responds well.",responds,positive,0
After about a week I finally got it back and was told that the motherboard had failed and so they installed a new motherboard.,motherboard,negative,0
After about a week I finally got it back and was told that the motherboard had failed and so they installed a new motherboard.,motherboard,neutral,1
"It was slow, locked up, and also had hardware replaced after only 2 months!",hardware,negative,0
they had to replace the motherboard in April,motherboard,negative,0
"Yes, the computer was light weight, less expensive than the average laptop, and was pretty self explantory in use.",use,positive,0
"Also, if you need to talk to a representive at Microsoft, there is a charge, which I believe is robbery, since you are charged enormous amounts for a very badly designed system, which most people would have went with XP if they could.",representive at Microsoft,negative,0
"Also, if you need to talk to a representive at Microsoft, there is a charge, which I believe is robbery, since you are charged enormous amounts for a very badly designed system, which most people would have went with XP if they could.",system,negative,0
"Also, if you need to talk to a representive at Microsoft, there is a charge, which I believe is robbery, since you are charged enormous amounts for a very badly designed system, which most people would have went with XP if they could.",XP,positive,0
I love WIndows 7 which is a vast improvment over Vista.,WIndows 7,positive,0
I love WIndows 7 which is a vast improvment over Vista.,Vista,negative,0
"Keyboard is great, very quiet for all the typing that I do.",Keyboard,positive,0
Dell's customer disservice is an insult to it's customers who pay good money for shoddy products.,Dell's customer disservice,negative,0
"It had a cooling system malfunction after 10 minutes of general use, and would not move past this error.",cooling system,negative,0
"It had a cooling system malfunction after 10 minutes of general use, and would not move past this error.",use,neutral,0
"I can render AVCHD movies with little effort, which was a problem for most pc's unless you had a quad core I7.",quad core I7,positive,0
"After talking it over with the very knowledgeable sales associate, I chose the MacBook Pro over the white MacBook.",sales associate,positive,0
"If you really want a bang-up system and don't need to run Windows applications, go with an Apple;",system,positive,0
"If you really want a bang-up system and don't need to run Windows applications, go with an Apple;",Windows applications,neutral,0
You won't have to spend gobs of money on some inefficient virus program that needs to be updated every month and that constantly drains your wallet.,virus program,negative,0
It weighed like seven pounds or something like that.,weighed,neutral,0
It weighed like seven pounds or something like that.,seven pounds,neutral,0
"2 months later, the battery went.",battery,negative,0
You may need to special order a bag.,bag,neutral,0
It's color is even cool.,color,positive,0
keys are all in weird places and is way too large for the way it is designed.,keys,negative,0
keys are all in weird places and is way too large for the way it is designed.,designed,negative,0
"Yes, a Mac is much more money than the average laptop out there, but there is no comparison in style, speed and just cool factor.",style,positive,0
"Yes, a Mac is much more money than the average laptop out there, but there is no comparison in style, speed and just cool factor.",speed,positive,0
The keyboard feels good and I type just fine on it.,keyboard,positive,0
I thought the white Mac computers looked dirty too quicly where you use the mousepad and where you place your hands when typing.,mousepad,neutral,0
"And not to mention after using it for a few months or so, the battery will slowly less and less hold a charge until you can't leave it unplugged for more than 5 minutes without the thing dying.",battery,negative,0
"BEST BUY - 5 STARS + + + (sales, service, respect for old men who aren't familiar with the technology) DELL COMPUTERS - 3 stars DELL SUPPORT - owes a me a couple",sales,positive,0
"BEST BUY - 5 STARS + + + (sales, service, respect for old men who aren't familiar with the technology) DELL COMPUTERS - 3 stars DELL SUPPORT - owes a me a couple",service,positive,0
"BEST BUY - 5 STARS + + + (sales, service, respect for old men who aren't familiar with the technology) DELL COMPUTERS - 3 stars DELL SUPPORT - owes a me a couple",DELL SUPPORT,positive,0
"no complaints with their desktop, and maybe because it just sits on your desktop, and you don't carry it around, which could jar the hard drive, or the motherboard.",hard drive,neutral,0
"no complaints with their desktop, and maybe because it just sits on your desktop, and you don't carry it around, which could jar the hard drive, or the motherboard.",motherboard,neutral,0
"Yes, they cost more, but they more than make up for it in speed, construction quality, and longevity.",speed,positive,0
"Yes, they cost more, but they more than make up for it in speed, construction quality, and longevity.",construction quality,positive,0
"Yes, they cost more, but they more than make up for it in speed, construction quality, and longevity.",longevity,positive,0
"Yes, they cost more, but they more than make up for it in speed, construction quality, and longevity.",cost,conflict,0
"Since I keyboard over 100 wpm, I look for a unit that has a comfortble keyboard (no keys sticking or lagging, strange configuration of ""extra key"", etc.",keyboard,positive,1
"Since I keyboard over 100 wpm, I look for a unit that has a comfortble keyboard (no keys sticking or lagging, strange configuration of ""extra key"", etc.",keys,positive,0
"Since I keyboard over 100 wpm, I look for a unit that has a comfortble keyboard (no keys sticking or lagging, strange configuration of ""extra key"", etc.","configuration of ""extra key""",positive,0
) I also tried the touch pad and compared it to other netbooks in the store.,touch pad,neutral,0
"It absolutely is more expensive than most PC laptops, but the ease of use, security, and minimal problems that have arisen make it well worth the pricetag.",use,positive,0
"It absolutely is more expensive than most PC laptops, but the ease of use, security, and minimal problems that have arisen make it well worth the pricetag.",security,positive,0
"It absolutely is more expensive than most PC laptops, but the ease of use, security, and minimal problems that have arisen make it well worth the pricetag.",pricetag,conflict,0
"  It gets stuck all of the time you use it, and you have to keep tapping on it to get it to work.",use,negative,0
"  It gets stuck all of the time you use it, and you have to keep tapping on it to get it to work.",work,negative,0
lots of preloaded software.,preloaded software,positive,0
"I wish it had a webcam though, then it would be perfect!",webcam,negative,0
My favorite part of this computer is that it has a vga port so I can connect it to a bigger screen.,vga port,positive,0
My favorite part of this computer is that it has a vga port so I can connect it to a bigger screen.,screen,neutral,0
Another thing I might add is the battery life is excellent.,battery life,positive,0
"One drawback, I wish the keys were backlit.",keys,negative,0
"Acer was no help and Garmin could not determine the problem(after spending about 2 hours with me), so I returned it and purchased a Toshiba R700 that seems even nicer and I was able to load all of my software with no problem.",software,positive,0
I wish the volume could be louder and the mouse didnt break after only a month.,volume,negative,0
I wish the volume could be louder and the mouse didnt break after only a month.,mouse,negative,0
"I play a lot of casual games online, and the touchpad is very responsive.",touchpad,positive,0
"Granted, it's still a very new laptop but in comparison to my previous laptops and desktops, my Mac boots up noticeably quicker.",boots up,positive,0
It caught a virus that completely wiped out my hard drive in a matter of hours.,hard drive,negative,0
"It is everything I'd hoped it would be from a look and feel standpoint, but somehow a bit more sturdy.",look and feel standpoint,positive,0
the only fact i dont like about apples is they generally use safari and i dont use safari but after i install Mozzilla firfox i love every single bit about it.,safari,negative,0
the only fact i dont like about apples is they generally use safari and i dont use safari but after i install Mozzilla firfox i love every single bit about it.,safari,negative,1
the only fact i dont like about apples is they generally use safari and i dont use safari but after i install Mozzilla firfox i love every single bit about it.,Mozzilla firfox,positive,0
