text,span,label,ordinal
"-4 RAM slots, 2 HDD Bays*, 16GB RAM support -No Wireless Issues, at least for me.",HDD Bays,neutral,0
"-4 RAM slots, 2 HDD Bays*, 16GB RAM support -No Wireless Issues, at least for me.",16GB RAM support,neutral,0
"-4 RAM slots, 2 HDD Bays*, 16GB RAM support -No Wireless Issues, at least for me.",Wireless,positive,0
I agree with the previous comment that ASUS TECH SUPPORT IS HORRIBLE WHICH IS A CON IN MY OPINION.,ASUS TECH SUPPORT,negative,0
"In fact, somehow (and I never opened it up) some specks of dust or something got inside the screen and are now there permanently, behind the front of the screen, in the way of the display.",screen,negative,0
"In fact, somehow (and I never opened it up) some specks of dust or something got inside the screen and are now there permanently, behind the front of the screen, in the way of the display.",screen,negative,1
"In fact, somehow (and I never opened it up) some specks of dust or something got inside the screen and are now there permanently, behind the front of the screen, in the way of the display.",display,negative,0
"the mouse on the pad, the left button always sticks.",mouse on the pad,neutral,0
"the mouse on the pad, the left button always sticks.",left button,negative,0
  i have tried to charge on different batteries with no luck.,batteries,negative,0
"I would recommend this computer to anyone searching for the perfect laptop, and the battery life is amazing.",battery life,positive,0
the size of has actually help me out quite a bit by me being able to fit it in an already full backpack and to use it at a resturant where the food on the table is always so space consuming.,size,positive,0
True quality at a great price!,quality,positive,0
True quality at a great price!,price,positive,0
Not easy to carry.,carry,negative,0
"So what am I supposed to do?  The LG service center cannot provide me the ""service"" when it is called the ""service center"".",LG service center,negative,0
"So what am I supposed to do?  The LG service center cannot provide me the ""service"" when it is called the ""service center"".",service center,negative,1
"So what am I supposed to do?  The LG service center cannot provide me the ""service"" when it is called the ""service center"".",service,negative,1
The Material this Pro is made out of seems a lot nicer than any PC  Specs: Like I said this performs a lot better than any computer I've had in the past.,Material,positive,0
The Material this Pro is made out of seems a lot nicer than any PC  Specs: Like I said this performs a lot better than any computer I've had in the past.,Specs,negative,0
The Material this Pro is made out of seems a lot nicer than any PC  Specs: Like I said this performs a lot better than any computer I've had in the past.,performs,positive,0
"After doing extensive research, macconnection had the lowest price on the 15"" MBP i5.",price,positive,0
I am ADDICTED to photo booth!,photo booth,positive,0
"The operating system and user interface is very intuitive, and the large multi-touch track pad is amazing.",operating system,positive,0
"The operating system and user interface is very intuitive, and the large multi-touch track pad is amazing.",user interface,positive,0
"The operating system and user interface is very intuitive, and the large multi-touch track pad is amazing.",multi-touch track pad,positive,0
And the screen on this thing is absolutely amazing for high quality videos and movies and gaming.,screen,positive,0
And the screen on this thing is absolutely amazing for high quality videos and movies and gaming.,gaming,positive,0
  i must keep it plugged in at all times because it will not keep a charge for longer than four minutes.,charge,negative,0
"I saw walmart had the same computer for about $650 but still knowing what I know now,I would not buy it at that price.",price,negative,0
"Now mainboard is broken, have to wait for a new one.",mainboard,negative,0
"The speed difference is next to NOTHING for a mac, and the hard drive can be manually upgraded or you could just buy a $60 500gb external hard drive.",speed,negative,0
"The speed difference is next to NOTHING for a mac, and the hard drive can be manually upgraded or you could just buy a $60 500gb external hard drive.",hard drive,neutral,0
"The speed difference is next to NOTHING for a mac, and the hard drive can be manually upgraded or you could just buy a $60 500gb external hard drive.",500gb external hard drive,neutral,0
2.The wireless card is low quality.,wireless card,negative,0
They also use two totally different operating systems.,operating systems,neutral,0
"The people are frustrating to work with, the product itself is very cheaply made, and the accessories are less than satisfactory.",accessories,negative,0
"They offer the best warranty in the business, and don't 3rd party it out like Toshiba.",warranty,positive,0
i love the size of the computer since i play games on it.,size,positive,0
i love the size of the computer since i play games on it.,games,neutral,0
"You know, using the computer should be fun, not aggrevation, especially when you are playing games or working with photos.",playing games,neutral,0
To be honest i think it was faulty equipment or something but idk.,equipment,negative,0
"I also love the small, convenient size of my laptop, making it a perfect tool for my academic studies.",size,positive,0
"I love its solid build, light wt and excellent battery life (for now).",build,positive,0
"I love its solid build, light wt and excellent battery life (for now).",wt,positive,0
"I love its solid build, light wt and excellent battery life (for now).",battery life,positive,0
"while about 8 years ago, I hope that the quality has changed.",quality,negative,0
"The difference is it's a whole lot of fun using the laptop now, still learning the Apple navigation, but is fun and comes with a lot of cool apps.",Apple navigation,neutral,0
"The difference is it's a whole lot of fun using the laptop now, still learning the Apple navigation, but is fun and comes with a lot of cool apps.",apps,positive,0
-I propose that I can just swap the hard drives.,hard drives,neutral,0
"The battery holds up well, it's built very solidly, and runs fast.",battery,positive,0
"The battery holds up well, it's built very solidly, and runs fast.",built,positive,0
"The battery holds up well, it's built very solidly, and runs fast.",runs,positive,0
Sound card is limited though.,Sound card,negative,0
  The only thing I can imagine is that Sony jumped on early specifications for Vista requirements from Microsoft and designed it to those inadequate requirements.,Vista,negative,0
"The keyboard, which generally felt okay even for someone used to a desktop keyboard, now looks terrible.",desktop keyboard,neutral,0
The display is awesome.,display,positive,0
It took several weeks just to get them to acknowledge that I owned the warranty.,warranty,negative,0
-Computer crashed frequently and battery life decreased very quickly.,battery life,negative,0
-I propose that they can just swap the hard drives.,hard drives,neutral,0
Every driver on the drivers/applications DVD is everything you will need for a reload.,driver,positive,0
Every driver on the drivers/applications DVD is everything you will need for a reload.,drivers/applications DVD,positive,0
I called their repair depot as was told they would send Me a new box to return the computer to the repair depot.,repair depot,neutral,0
I called their repair depot as was told they would send Me a new box to return the computer to the repair depot.,repair depot,neutral,1
It's also fairly easy to use the Operating System.,Operating System,positive,0
Peformance is good for the price.,Peformance,positive,0
Peformance is good for the price.,price,positive,0
Summary: HP knew they were shipping out bad BIOS and did nothing proactive to resolve it.,BIOS,negative,0
"The improvements to the OS have been relatively gradual, but substantive.",OS,positive,0
It is super easy to use.,use,positive,0
Many of my classmates computers hard drives crashed.,hard drives,negative,0
Ease of use is just one of the benefits I love about my Mac.,use,positive,0
"I wouldn't play a first-person shooter with this, mind, but if you wanted to run MS Office, email, chat, download a video, listen to music from a certain fruit-named music store, and were looking for a highly portable yet powerful netbook to do that all in, I'd highly recommend checking this out.",MS Office,neutral,0
"The 13"" Macbook Pro just fits in my budget and with free shipping and no tax to CA this is the best price we can get for a great product.",shipping,positive,0
"The 13"" Macbook Pro just fits in my budget and with free shipping and no tax to CA this is the best price we can get for a great product.",price,positive,0
"The 13"" Macbook Pro just fits in my budget and with free shipping and no tax to CA this is the best price we can get for a great product.",budget,positive,0
The sheer power and flexibility makes the MacBook Pro a must have for any techie!,power,positive,0
The sheer power and flexibility makes the MacBook Pro a must have for any techie!,flexibility,positive,0
The speakers on it are useless too.,speakers,negative,0
Battery is lasting about 6 hours as I am surfing the web on Sundays while checking football scores and watching funny Youtube videos.,Battery,neutral,0
Battery is lasting about 6 hours as I am surfing the web on Sundays while checking football scores and watching funny Youtube videos.,surfing the web,neutral,0
Iphoto is great for adding pictures right to facebook and other social networking sites.,Iphoto,positive,0
"In early May I got it back and this time I only had it back for 1 day before it had a NEW issue so it was sent back in for the 6th time they ""expedited"" the repairs so I was only supposed to have to be without it for 3 days and it was supposed to be fixed, by a ""Senior Tech"".",Senior Tech,negative,0
"Some features arent friendly ( volume wheel, sound quality, etc.",volume wheel,negative,0
"Some features arent friendly ( volume wheel, sound quality, etc.",sound quality,negative,0
"Some features arent friendly ( volume wheel, sound quality, etc.",features,negative,0
"A cheaper price should not equal a ""cheap"" product.",price,positive,0
Thank you Best Buy for putting my computer together and installing my first software - you guys were GREAT too!,software,neutral,0
Adjust the sensitivity since it's not that responsive to begin with.,sensitivity,negative,0
"After a couple of years, my battery life began to diminish but was replaced for free due to a company-wide recall of my particular battery.",battery,negative,1
"The system constantly overheats, the battery life is too short, the case is coming apart, and my core applications that I use every day in my work as a graphic artist run poorly.",battery life,negative,0
"The system constantly overheats, the battery life is too short, the case is coming apart, and my core applications that I use every day in my work as a graphic artist run poorly.",case,negative,0
"The system constantly overheats, the battery life is too short, the case is coming apart, and my core applications that I use every day in my work as a graphic artist run poorly.",core applications,negative,0
"The system constantly overheats, the battery life is too short, the case is coming apart, and my core applications that I use every day in my work as a graphic artist run poorly.",system,negative,0
  Later it held zero charge and its replacement worked for less than three months.,charge,negative,0
  The company sent me a whole new cord overnight and apologized.,cord,positive,0
It's even easy to hook up to other wireless networks.,hook up to other wireless networks,positive,0
"  Also, I have had alot of trouble with the shift key to go to other lines.",shift key,negative,0
"The rep did not even answer my question, I had to ask him, if he understood what I ask or if he spoke english because he didn't even try to acknowledge my question.",rep,negative,0
It gives me the power and speed that I need to run all the programs I use to edit.,power,positive,0
It gives me the power and speed that I need to run all the programs I use to edit.,speed,positive,0
It gives me the power and speed that I need to run all the programs I use to edit.,programs,neutral,0
iLife is easily compatible with Microsoft Office so you can send and receive files from a PC.,iLife,positive,0
iLife is easily compatible with Microsoft Office so you can send and receive files from a PC.,Microsoft Office,neutral,0
  Again I sent it back and they replaced the motherboard and some fan inside.,motherboard,neutral,0
  Again I sent it back and they replaced the motherboard and some fan inside.,fan,neutral,0
"I know there are way better laptops out there for the same price, and why spend money on shit when you can go out and get yourself a perfectly decent laptop that doesnt suck total monkey balls.",price,neutral,0
"For me, keys were starting to get stuck and wouldn't type very well.",keys,negative,0
can't reinstall with standard os cd because of proprietary hardware drivers.,standard os cd,negative,0
can't reinstall with standard os cd because of proprietary hardware drivers.,proprietary hardware drivers,negative,0
"There is a small red circle next to it with a x in the middle, and when I click on it it says: "" Consider replacing your battery"" and it does not hold full charge.",battery,neutral,0
"There is a small red circle next to it with a x in the middle, and when I click on it it says: "" Consider replacing your battery"" and it does not hold full charge.",charge,negative,0
The computer was two weeks late in delivery because HP forgot to complete the required import paperwork.,delivery,negative,0
I have been very pleased with the performance of this laptop.,performance,positive,0
"I bought it for my mom and she reports that the battery life lasts all day for her, it's very lightweight, and the response for the computing she's doing (Internet focused activity: mail, research, etc.) is excellent;",battery life,positive,0
"I bought it for my mom and she reports that the battery life lasts all day for her, it's very lightweight, and the response for the computing she's doing (Internet focused activity: mail, research, etc.) is excellent;",response,positive,0
"I bought it for my mom and she reports that the battery life lasts all day for her, it's very lightweight, and the response for the computing she's doing (Internet focused activity: mail, research, etc.) is excellent;",Internet focused activity,neutral,0
Its very nice and once you learn the features you will be so happy to have such a sophisticated computer.,features,neutral,0
It is sleek and lightweight and charges quickly when needed.,charges,positive,0
( The iBook backup also uses a firewire connection).,iBook backup,neutral,0
( The iBook backup also uses a firewire connection).,firewire connection,neutral,0
"I did think it had a camera because that was one of my requirements, but forgot to check in the specifications on this one before I purchased.",camera,neutral,0
"I did think it had a camera because that was one of my requirements, but forgot to check in the specifications on this one before I purchased.",specifications,neutral,0
Also the display is exceptional!,display,positive,0
Learning all of the keyboard shortcuts only took a few minutes to get used to as some of the shortcuts are the same on Windows machines.,keyboard shortcuts,positive,0
Learning all of the keyboard shortcuts only took a few minutes to get used to as some of the shortcuts are the same on Windows machines.,shortcuts,neutral,1
little short on RAM but you get what you pay for.,RAM,negative,0
"It didn't come with any software installed outside of windows media, but for the price, I was very pleased with the condition and the overall product.",software,negative,0
"It didn't come with any software installed outside of windows media, but for the price, I was very pleased with the condition and the overall product.",windows media,neutral,0
"It didn't come with any software installed outside of windows media, but for the price, I was very pleased with the condition and the overall product.",price,positive,0
"THEN, one month after the warranty expired, the replacement charger went.",warranty,neutral,0
"THEN, one month after the warranty expired, the replacement charger went.",replacement charger,negative,0
"Your cursor will end up all over the freaking place,,,it's not uncommon for me to accidentally delete words, sentences, paragraphs because of this mousepad.",cursor,negative,0
"Your cursor will end up all over the freaking place,,,it's not uncommon for me to accidentally delete words, sentences, paragraphs because of this mousepad.",mousepad,negative,0
"  Then I've fixed the DC jack (inside the unit), rewired the DC jack to the OUTside of the laptop, replaced the power brick.",DC jack,neutral,0
"  Then I've fixed the DC jack (inside the unit), rewired the DC jack to the OUTside of the laptop, replaced the power brick.",DC jack,neutral,1
"  Then I've fixed the DC jack (inside the unit), rewired the DC jack to the OUTside of the laptop, replaced the power brick.",power brick,neutral,0
The built-in webcam is great for Skype and similar video-chat services.,built-in webcam,positive,0
The shop will definitely push the problem to the service center.,service center,neutral,0
"PC users work in Word, while Mac users work in Pages.",Word,neutral,0
"PC users work in Word, while Mac users work in Pages.",Pages,neutral,0
"While I mostly use it for email, internet and gaming, I'm confident all other applications live up to the high standard I've come to appreciate from Mac laptops.",applications,positive,0
"While I mostly use it for email, internet and gaming, I'm confident all other applications live up to the high standard I've come to appreciate from Mac laptops.",internet,neutral,0
"While I mostly use it for email, internet and gaming, I'm confident all other applications live up to the high standard I've come to appreciate from Mac laptops.",gaming,neutral,0
pros:  the macbook pro notebook has a large battery life and you wont have to worry to charge your laptop every five hours or so.,battery life,positive,0
Disappointing for such a lovely screen and at a reasonable price,screen,positive,0
Disappointing for such a lovely screen and at a reasonable price,price,positive,0
Good price.,price,positive,0
the speed is fine.,speed,positive,0
"It was not clear that the Microsoft Student Edition that was loaded on the computer, was a six month trial.",Microsoft Student Edition,negative,0
Good for every day computing and web browsing.,web browsing,positive,0
Good for every day computing and web browsing.,every day computing,positive,0
Excellent LED monitor and well equipped.,LED monitor,positive,0
"Without a doubt, the *design* of this laptop is fantastic.",design,positive,0
I couldn't believe how long the battery lasted on a single charge.,battery,positive,0
I couldn't believe how long the battery lasted on a single charge.,charge,positive,0
"Other than that, I would recommend this to someone in need of a cheap laptop with semi-decent gaming capabilities.",gaming,positive,0
"This is the first time that I tried and owning a netbook although I have used 3 different laptops in the past 10 years, I find not much difference except of course for the screen size.",screen size,neutral,0
But the biggest pain is that tech support is not available 24/7.,tech support,negative,0
The backlit keys are wonderful when you are working in the dark.,backlit keys,positive,0
"The most recent being that my Safari internet browser is freaking out on me, but I have just been using firefox instead.",Safari internet browser,negative,0
"The most recent being that my Safari internet browser is freaking out on me, but I have just been using firefox instead.",firefox,positive,0
I did not have to call the support line at all.,support line,neutral,0
THE FIRST PROBLEM IS THAT THE KEYBOARD FUNCTION IS SIMPLY UNSATISFACTORY.,KEYBOARD FUNCTION,negative,0
"The DVD drive randomly pops open when it is in my backpack as well, which is annoying.",DVD drive,negative,0
"Garageband is more for the musicians, and the laptop is equipped with a good working microphone, good enough for beginners and musicians at the intermediate level.",Garageband,neutral,0
"Garageband is more for the musicians, and the laptop is equipped with a good working microphone, good enough for beginners and musicians at the intermediate level.",microphone,positive,0
I dual boot with Linux and that other security-prone OS and it performs flawlessly.,Linux,neutral,0
I dual boot with Linux and that other security-prone OS and it performs flawlessly.,security-prone OS,neutral,0
I dual boot with Linux and that other security-prone OS and it performs flawlessly.,performs,positive,0
The difference is the Toshiba had a lot more memory and hard drive space.,memory,positive,0
The difference is the Toshiba had a lot more memory and hard drive space.,hard drive space,positive,0
Seems like maybe a bad shipment from Toshiba.,shipment,negative,0
OS X is solid with lots of innovations such as quicklook which save heaps of time.,OS X,positive,0
OS X is solid with lots of innovations such as quicklook which save heaps of time.,quicklook,positive,0
But other than that I am blown away by all the features this laptop offers.,features,positive,0
First the screen goes completely out.,screen,negative,0
"The PhotoBooth is a great program, it takes very good pictures with the built-in camera.",PhotoBooth,positive,0
"The PhotoBooth is a great program, it takes very good pictures with the built-in camera.",program,positive,0
"The PhotoBooth is a great program, it takes very good pictures with the built-in camera.",built-in camera,positive,0
I had to pay for the shipping!,shipping,negative,0
"It bluescreened on me without any warning, running simply basic Chrome.",Chrome,negative,0
I took 3-4 years researching brands and prices of laptops.,prices,neutral,0
We researched and found the best price at MacConnection.,price,positive,0
But guess what?  (you have to buy an external dvd drive it doesn't have a built in type) The notebook can't be used because it doesn't read anything for an external drive.,external dvd drive,negative,0
But guess what?  (you have to buy an external dvd drive it doesn't have a built in type) The notebook can't be used because it doesn't read anything for an external drive.,external drive,negative,0
GET THIS COMPUTER FOR PORTABILITY AND FAST PROCESSING!!!,PORTABILITY,positive,0
GET THIS COMPUTER FOR PORTABILITY AND FAST PROCESSING!!!,PROCESSING,positive,0
I use a cooling pad but it doesn't help.,cooling pad,negative,0
I'm tired of the inept service.,service,negative,0
"Garageband is easy to work with, like all the other apple applications I've had experience with.",Garageband,positive,0
"Garageband is easy to work with, like all the other apple applications I've had experience with.",apple applications,positive,0
"Because we did not purchase the extended warranty in time, we are on the hook for the repair.",extended warranty,negative,0
This laptop looked brand new and was shipped very quickly.,shipped,positive,0
"Info: Windows failed to load because the kernal is missing, or corrupt.",Windows,negative,0
"Info: Windows failed to load because the kernal is missing, or corrupt.",kernal,negative,0
"But the quality, in general was less than the worth of the cheap laptop.",quality,negative,0
"The graphics and screen are stunning and although I was a PC person, I was able to understand how to use a mac fairly quickly.",graphics,positive,0
"The graphics and screen are stunning and although I was a PC person, I was able to understand how to use a mac fairly quickly.",screen,positive,0
"WIth the upgraded memory, the MacBook Pro never has an issue running many many applications at once!",upgraded memory,positive,0
"WIth the upgraded memory, the MacBook Pro never has an issue running many many applications at once!",applications,neutral,0
"WIth the upgraded memory, the MacBook Pro never has an issue running many many applications at once!",running,positive,0
"Simple to use, and great graphics.",graphics,positive,0
"Simple to use, and great graphics.",use,positive,0
"My husband uses it mostly for games, email and music.",games,neutral,0
"Apparently under the screen there are 2 little screws and when the screen gets moved back and forth, they come loose.",screen,neutral,0
"Apparently under the screen there are 2 little screws and when the screen gets moved back and forth, they come loose.",screen,neutral,1
The computer will constantly be getting hot and burning your leg unless you go through the hassle of taking off the entire back of it just to clean out the fan.,fan,negative,0
"I have in the past gotten superfine sandpaper and ""fixed"" the edges by rounding them off.",edges,negative,0
"Did I mention everything about it, from size to weight to keyboard screams BULK?",size,negative,0
"Did I mention everything about it, from size to weight to keyboard screams BULK?",weight,negative,0
"Did I mention everything about it, from size to weight to keyboard screams BULK?",keyboard,negative,0
"So, after Apple replaced the hard drive I enjoyed another 4 months of my new computer, until it froze this morning--completely.",hard drive,neutral,0
"The Macbook starts fast, doesn't crash, has a fantastic display, is small and light (I have the 13.3"" model), and isn't always complaining about updates, lost connections, errors, blue screens, etc.",display,positive,0
"The Macbook starts fast, doesn't crash, has a fantastic display, is small and light (I have the 13.3"" model), and isn't always complaining about updates, lost connections, errors, blue screens, etc.",starts,positive,0
Unable to boot up this brand new laptop.,boot up,negative,0
